{
  "schema_version": "csam-thesis-feedback-gate.v1",
  "policy": {
    "target": "95",
    "target_max_points": 95.0,
    "raw_visible_rubric_sum": 100.0,
    "pass_threshold_points": 57,
    "excellent_threshold_points": 90,
    "require_guideline_gates": true,
    "require_empirical_execution_for_95": true
  },
  "document": {
    "path": "research/thesis/thesis.tex",
    "word_count_proxy": 1593,
    "headings_detected": [
      {
        "level": 1,
        "title": "Abstract",
        "line": 17
      },
      {
        "level": 1,
        "title": "Introduction",
        "line": 23
      },
      {
        "level": 1,
        "title": "Methodology",
        "line": 35
      },
      {
        "level": 1,
        "title": "Solution",
        "line": 47
      },
      {
        "level": 1,
        "title": "Results",
        "line": 68
      },
      {
        "level": 2,
        "title": "Corpus",
        "line": 74
      },
      {
        "level": 2,
        "title": "Build, Test, and Coverage",
        "line": 77
      },
      {
        "level": 2,
        "title": "Reproducibility and Classification Agreement",
        "line": 82
      },
      {
        "level": 2,
        "title": "Semantic Convention and Telemetry Evidence",
        "line": 87
      },
      {
        "level": 2,
        "title": "Raw Evidence",
        "line": 92
      },
      {
        "level": 1,
        "title": "Discussion",
        "line": 98
      },
      {
        "level": 1,
        "title": "Raw Evidence",
        "line": 110
      },
      {
        "level": 1,
        "title": "AI Tool Documentation",
        "line": 115
      },
      {
        "level": 1,
        "title": "Schemas",
        "line": 121
      },
      {
        "level": 1,
        "title": "Scripts",
        "line": 127
      }
    ],
    "citation_count": 2,
    "figures": 1,
    "tables": 0,
    "listings": 0,
    "lexical_trap_count": 0
  },
  "assessment": {
    "criteria": {
      "problem_definition": {
        "title": "Problem Statement and Objective Definition",
        "raw_max_points": 5,
        "max_points": 4.75,
        "fulfillment_percent": 100.0,
        "raw_points": 5.0,
        "points": 4.75,
        "checks": {
          "problem_clear_precise": true,
          "scientific_context_present": true,
          "objective_explicit": true,
          "expected_result_measurable": true
        },
        "evidence": [
          {
            "section": "Document",
            "claim": "Evidence for Problem Statement and Objective Definition / problem_clear_precise.",
            "quote": "The central problem of this work is therefore practical: the research project must turn local agent-evaluation ideas into reproducible engineering evidence without inventing measurements.",
            "confidence": 0.7,
            "source_location": "detected_text"
          },
          {
            "section": "Solution",
            "claim": "Evidence for Problem Statement and Objective Definition / scientific_context_present.",
            "quote": "This thesis evaluates whether a private AI-only research infrastructure can be upgraded from a framework specification into an empirically executed engineering artifact.",
            "confidence": 0.7,
            "source_location": "detected_text"
          },
          {
            "section": "Document",
            "claim": "Evidence for Problem Statement and Objective Definition / scientific_context_present.",
            "quote": "The central problem of this work is therefore practical: the research project must turn local agent-evaluation ideas into reproducible engineering evidence without inventing measurements.",
            "confidence": 0.7,
            "source_location": "detected_text"
          },
          {
            "section": "Solution",
            "claim": "Evidence for Problem Statement and Objective Definition / objective_explicit.",
            "quote": "This thesis evaluates whether a private AI-only research infrastructure can be upgraded from a framework specification into an empirically executed engineering artifact.",
            "confidence": 0.7,
            "source_location": "detected_text"
          }
        ]
      },
      "methodology_and_approach": {
        "title": "Methodology and Solution Approach",
        "raw_max_points": 40,
        "max_points": 38.0,
        "fulfillment_percent": 100.0,
        "raw_points": 40.0,
        "points": 38.0,
        "checks": {
          "ideal_solution_before_constraints": true,
          "requirements_engineering_present": true,
          "method_selection_justified": true,
          "alternatives_discussed": true,
          "development_process_phased": true,
          "technology_choice_argued": true,
          "testing_methodology_defined": true,
          "implementation_reproducible": true
        },
        "evidence": [
          {
            "section": "Solution",
            "claim": "Evidence for Methodology and Solution Approach / ideal_solution_before_constraints.",
            "quote": "The ideal solution would evaluate managed coding agents on a curated benchmark corpus with explicit ground-truth tasks, independent reviewers, multiple agent vendors, repeated runs, preserved prompts, and statistically justified comparisons.",
            "confidence": 0.7,
            "source_location": "detected_text"
          },
          {
            "section": "Document",
            "claim": "Evidence for Methodology and Solution Approach / requirements_engineering_present.",
            "quote": "First, each corpus target is described in JSON with path, kind, expected build and test behavior, coverage requirement, telemetry requirement, and ground-truth status.",
            "confidence": 0.7,
            "source_location": "detected_text"
          },
          {
            "section": "Document",
            "claim": "Evidence for Methodology and Solution Approach / method_selection_justified.",
            "quote": "qyl and Arqio were selected because they match the research question. qyl contains the automation, OpenTelemetry, dashboard, collector, and semantic-convention surfaces needed to evaluate instrumentation-aware research infrastructure.",
            "confidence": 0.7,
            "source_location": "detected_text"
          },
          {
            "section": "Document",
            "claim": "Evidence for Methodology and Solution Approach / alternatives_discussed.",
            "quote": "Alternatives were considered implicitly by the available local workspace: a standalone thesis-only script would be simpler, but it would not exercise the same automation and observability surfaces; a cloud benchmark would be broader, but it would introduce credentials and non-local reproducibility risk.",
            "confidence": 0.85,
            "source_location": "detected_text"
          }
        ]
      },
      "results_and_discussion": {
        "title": "Results and Discussion",
        "raw_max_points": 40,
        "max_points": 38.0,
        "fulfillment_percent": 95.0,
        "raw_points": 38.0,
        "points": 36.1,
        "checks": {
          "artifact_evaluated_against_goals": true,
          "empirical_results_reported": true,
          "analysis_interprets_results": true,
          "limitations_critical": true,
          "generalizability_discussed": true,
          "improvements_future_work": true,
          "raw_or_appendix_evidence_present": true,
          "no_hypothetical_only_evaluation": true
        },
        "evidence": [
          {
            "section": "Document",
            "claim": "Evidence for Results and Discussion / artifact_evaluated_against_goals.",
            "quote": "Empirical Infrastructure for Managed AI Coding-Agent Evaluation",
            "confidence": 0.7,
            "source_location": "detected_text"
          },
          {
            "section": "Solution",
            "claim": "Evidence for Results and Discussion / artifact_evaluated_against_goals.",
            "quote": "This thesis evaluates whether a private AI-only research infrastructure can be upgraded from a framework specification into an empirically executed engineering artifact.",
            "confidence": 0.7,
            "source_location": "detected_text"
          },
          {
            "section": "Document",
            "claim": "Evidence for Results and Discussion / empirical_results_reported.",
            "quote": "It does not claim managed-agent accuracy, vendor comparison, or statistical significance unless those runs are actually executed.",
            "confidence": 0.7,
            "source_location": "detected_text"
          },
          {
            "section": "Document",
            "claim": "Evidence for Results and Discussion / empirical_results_reported.",
            "quote": "The contribution is therefore a measured dynamic-harness baseline for bachelor-thesis evidence production rather than a fabricated agent benchmark.",
            "confidence": 0.7,
            "source_location": "detected_text"
          }
        ]
      },
      "structure_and_organization": {
        "title": "Structure and Organization",
        "raw_max_points": 5,
        "max_points": 4.75,
        "fulfillment_percent": 53.8,
        "raw_points": 2.69,
        "points": 2.56,
        "checks": {
          "four_main_parts_present": true,
          "abstract_and_keywords_present": true,
          "bibliography_present": true,
          "appendix_present": false,
          "figures_tables_integrated": false
        },
        "evidence": []
      },
      "style_and_expression": {
        "title": "Style and Expression",
        "raw_max_points": 5,
        "max_points": 4.75,
        "fulfillment_percent": 75.0,
        "raw_points": 3.75,
        "points": 3.56,
        "checks": {
          "technical_language_precise": true,
          "neutral_academic_tone": true,